RecipeId,Barcode,Name,AuthorId,AuthorName,CookTime,PrepTime,TotalTime,DatePublished,Description,Images,RecipeCategory,Keywords,RecipeIngredientQuantities,RecipeIngredientParts,AggregatedRating,ReviewCount,Calories,FatContent,SaturatedFatContent,CholesterolContent,SodiumContent,CarbohydrateContent,FiberContent,SugarContent,ProteinContent,RecipeServings,RecipeYield,RecipeInstructions,extracted_image_urls,extracted_ingredients
39.0,*39*,Biryani,1567.0,elly9812,PT25M,PT4H,PT4H25M,1999-08-29T13:12:00Z,Make and share this Biryani recipe from Food.com.,"c(""https://img.sndimg.com/food/image/upload/w_555,h_416,c_fit,fl_progressive,q_95/v1/img/recipes/39/picM9Mhnw.jpg"", ""https://img.sndimg.com/food/image/upload/w_555,h_416,c_fit,fl_progressive,q_95/v1/img/recipes/39/picHv4Ocr.jpg"")",Chicken Breast,"c(""Chicken Thigh & Leg"", ""Chicken"", ""Poultry"", ""Meat"", ""Asian"", ""Indian"", ""Weeknight"", ""Stove Top"")","c(""1"", ""4"", ""2"", ""2"", ""8"", ""1/4"", ""8"", ""1/2"", ""1"", ""1"", ""1/4"", ""1/4"", ""1/2"", ""1/4"", ""2"", ""3"", NA, ""2"", ""1"", ""1"", ""8"", ""2"", ""1/3"", ""1/3"", ""1/3"", ""6"")","c(""saffron"", ""milk"", ""hot green chili peppers"", ""onions"", ""garlic"", ""clove"", ""peppercorns"", ""cardamom seed"", ""cumin seed"", ""poppy seed"", ""mace"", ""cilantro"", ""mint leaf"", ""fresh lemon juice"", ""plain yogurt"", ""boneless chicken"", ""salt"", ""ghee"", ""onion"", ""tomatoes"", ""basmati rice"", ""long-grain rice"", ""raisins"", ""cashews"", ""eggs"")",3.0,1.0,1110.7,58.8,16.6,372.8,368.4,84.4,9.0,20.4,63.4,6.0,,"c(""Soak saffron in warm milk for 5 minutes and puree in blender."", ""Add chiles, onions, ginger, garlic, cloves, peppercorns, cardamom seeds, cinnamon, coriander and cumin seeds, poppy seeds, nutmeg, mace, cilantro or mint leaves and lemon juice. Blend into smooth paste. Put paste into large bowl, add yogurt and mix well."", ""Marinate chicken in yogurt mixture with salt, covered for at least 2 - 6 hours in refrigerator."", ""In skillet. heat oil over medium heat for 1 minute. Add ghee and 15 seconds later add onion and fry for about8 minutes."", 
""Reserve for garnish."", ""In same skillet, cook chicken with its marinade with tomatoes for about 10 minutes over medium heat, uncovered."", ""Remove chicken pieces from the sauce and set aside. Add rice to sauce, bring to boil, and cook, covered over low heat for 15 minutes."", ""Return chicken and add raisins, cashews and almonds; mix well."", ""Simmer, covered for 5 minutes."", ""Place chicken, eggs and rice in large serving dish in such a way that yellow of the eggs, the saffron-colored rice, the nuts and the chicken make a colorful display."", 
""Add reserved onion as garnish."")","['https://img.sndimg.com/food/image/upload/w_555,h_416,c_fit,fl_progressive,q_95/v1/img/recipes/39/picM9Mhnw.jpg', 'https://img.sndimg.com/food/image/upload/w_555,h_416,c_fit,fl_progressive,q_95/v1/img/recipes/39/picHv4Ocr.jpg']","['saffron', 'milk', 'hot green chili peppers', 'onions', 'garlic', 'clove', 'peppercorns', 'cardamom seed', 'cumin seed', 'poppy seed', 'mace', 'cilantro', 'mint leaf', 'fresh lemon juice', 'plain yogurt', 'boneless chicken', 'salt', 'ghee', 'onion', 'tomatoes', 'basmati rice', 'long-grain rice', 'raisins', 'cashews', 'eggs']"
40.0,*40*,Best Lemonade,1566.0,Stephen Little,PT5M,PT30M,PT35M,1999-09-05T19:52:00Z,"This is from one of my  first Good House Keeping cookbooks.  You must use a *zester* in order to avoid getting any of that bitter rind, and when you zest the lemons, zest them onto some sugar from the recipe (the sugar will 'catch' all of the oils).  I also advise you from personal experience to use only the best skinned lemons for the best flavor.","c(""https://img.sndimg.com/food/image/upload/w_555,h_416,c_fit,fl_progressive,q_95/v1/img/recipes/40/picJ4Sz3N.jpg"", ""https://img.sndimg.com/food/image/upload/w_555,h_416,c_fit,fl_progressive,q_95/v1/img/recipes/40/pic23FWio.jpg"")",Beverages,"c(""Low Protein"", ""Low Cholesterol"", ""Healthy"", ""Summer"", ""< 60 Mins"")","c(""1 1/2"", ""1"", NA, ""1 1/2"", NA, ""3/4"")","c(""sugar"", ""lemons, rind of"", ""lemon, zest of"", ""fresh water"", ""fresh lemon juice"")",4.5,10.0,311.1,0.2,0.0,0.0,1.8,81.5,0.4,77.2,0.3,4.0,,"c(""Into a 1 quart Jar with tight fitting lid, put sugar and lemon peel, or zest;  add 1 1/2 cups very hot water (not from tap!). With lid fitted firmly, shake jar until sugar is dissolved."", ""Add lemon juice. Refrigerate until chilled."", ""To Serve: Into each 12-ounce glass, over ice cubes, pour 1/4 cup of the lemon syrup."", ""Then add chilled club soda or, if you prefer, water."", ""Stir to mix well."")","['https://img.sndimg.com/food/image/upload/w_555,h_416,c_fit,fl_progressive,q_95/v1/img/recipes/40/picJ4Sz3N.jpg', 'https://img.sndimg.com/food/image/upload/w_555,h_416,c_fit,fl_progressive,q_95/v1/img/recipes/40/pic23FWio.jpg']","['sugar', 'lemons, rind of', 'lemon, zest of', 'fresh water', 'fresh lemon juice']"
41.0,*41*,Carina's Tofu-Vegetable Kebabs,1586.0,Cyclopz,PT20M,PT24H,PT24H20M,1999-09-03T14:54:00Z,This dish is best prepared a day in advance to allow the ingredients to soak in  the marinade overnight.,"c(""https://img.sndimg.com/food/image/upload/w_555,h_416,c_fit,fl_progressive,q_95/v1/img/recipes/41/picmbLig8.jpg"", ""https://img.sndimg.com/food/image/upload/w_555,h_416,c_fit,fl_progressive,q_95/v1/img/recipes/41/picL02w0s.jpg"")",Soy/Tofu,"c(""Beans"", ""Vegetable"", ""Low Cholesterol"", ""Weeknight"", ""Broil/Grill"", ""Oven"")","c(""12"", ""1"", ""2"", ""1"", ""10"", ""1"", ""3"", ""2"", ""2"", ""2"", ""1"", ""2"", ""1/2"", ""1/4"", ""4"")","c(""extra firm tofu"", ""eggplant"", ""zucchini"", ""mushrooms"", ""soy sauce"", ""low sodium soy sauce"", ""olive oil"", ""maple syrup"", ""honey"", ""red wine vinegar"", ""lemon juice"", ""garlic cloves"", ""mustard powder"", ""black pepper"")",4.5,2.0,536.1,24.0,3.8,0.0,1558.6,64.2,17.3,32.1,29.3,2.0,4 kebabs,"c(""Drain the tofu, carefully squeezing out excess water,  and pat dry with paper towels."", ""Cut tofu into one-inch squares."", ""Set aside.  Cut  eggplant lengthwise in half, then cut each half into approximately three strips."", ""Cut strips crosswise into one-inch cubes."", ""Slice zucchini into half-inch thick  slices."", ""Cut red pepper in half, removing stem and seeds, and cut each half into  one-inch squares."", ""Wipe mushrooms clean with a moist paper towel and remove  stems."", ""Thread tofu and vegetables on to barbecue skewers in alternating color  combinations: For example, first a piece of eggplant, then a slice of tofu, then zucchini, then red pepper, baby corn and mushrooms."", 
""Continue in this way until  all skewers are full."", ""Make the marinade by putting all ingredients in a  blender, and blend on high speed for about one minute until mixed."", ""Alternatively, put all ingredients in a glass jar, cover tightly with the lid  and shake well until mixed."", ""Lay the kebabs in a long, shallow baking pan or on  a non-metal tray, making sure they lie flat. Evenly pour the marinade over the  kebabs, turning them once so that the tofu and vegetables are coated."", ""Refrigerate the kebabs for three to eight hours, occasionally spooning the  marinade over them."", 
""Broil or grill the kebabs at 450 F for 15-20 minutes, or on the grill, until the vegetables are browned."", ""Suggestions  This meal can be served over cooked, brown rice. Amounts can easily be doubled to make four servings."")","['https://img.sndimg.com/food/image/upload/w_555,h_416,c_fit,fl_progressive,q_95/v1/img/recipes/41/picmbLig8.jpg', 'https://img.sndimg.com/food/image/upload/w_555,h_416,c_fit,fl_progressive,q_95/v1/img/recipes/41/picL02w0s.jpg']","['extra firm tofu', 'eggplant', 'zucchini', 'mushrooms', 'soy sauce', 'low sodium soy sauce', 'olive oil', 'maple syrup', 'honey', 'red wine vinegar', 'lemon juice', 'garlic cloves', 'mustard powder', 'black pepper']"
47.0,*47*,Butter Pecan Cookies,1573.0,benluc,PT9M,PT55M,PT1H4M,1999-09-07T09:01:00Z,Make and share this Butter Pecan Cookies recipe from Food.com.,"c(""https://img.sndimg.com/food/image/upload/w_555,h_416,c_fit,fl_progressive,q_95/v1/img/recipes/47/picfnmxck.jpg"", ""https://img.sndimg.com/food/image/upload/w_555,h_416,c_fit,fl_progressive,q_95/v1/img/recipes/47/picCPvxZU.jpg"")",Dessert,"c(""Cookie & Brownie"", ""Fruit"", ""Nuts"", ""Weeknight"", ""Oven"", ""< 4 Hours"")","c(""3/4"", ""1/2"", ""1"", ""1"", ""1"", ""2"", ""1"")","c(""butter"", ""brown sugar"", ""granulated sugar"", ""vanilla extract"", ""flour"", ""pecan halves"")",4.0,2.0,69.0,5.6,1.4,6.3,15.0,4.5,0.6,1.6,0.8,,84 cookies,"c(""Preheat oven to 350 degrees."", ""Cream butter in large mixing bowl."", ""Gradually add brown sugar and granulated sugar."", ""Cream well."", ""Add unbeaten egg yolk and vanilla and beat well."", ""Blend in sifted flour to form a stiff dough."", ""Shape dough into small balls."", ""Place on greased cookie sheet. Flatten cookies with bottom of glass dipped in sugar."", ""Bake at 350 degrees for 7-9 minutes, till golden brown (do not overbrown.) Cool before frosting."", ""Garnish with pecan halves."")","['https://img.sndimg.com/food/image/upload/w_555,h_416,c_fit,fl_progressive,q_95/v1/img/recipes/47/picfnmxck.jpg', 'https://img.sndimg.com/food/image/upload/w_555,h_416,c_fit,fl_progressive,q_95/v1/img/recipes/47/picCPvxZU.jpg']","['butter', 'brown sugar', 'granulated sugar', 'vanilla extract', 'flour', 'pecan halves']"
52.0,*52*,Cafe Cappuccino,2178.0,troyh,,PT5M,PT5M,1999-08-31T21:05:00Z,Make and share this Cafe Cappuccino recipe from Food.com.,"c(""https://img.sndimg.com/food/image/upload/w_555,h_416,c_fit,fl_progressive,q_95/v1/img/recipes/52/picAkC0UW.jpg"", ""https://img.sndimg.com/food/image/upload/w_555,h_416,c_fit,fl_progressive,q_95/v1/img/recipes/52/piccYWEE1.jpg"")",Beverages,"c(""Low Cholesterol"", ""High Protein"", ""Healthy"", ""High In..."", ""< 15 Mins"", ""For Large Groups"", ""No Cook"", ""Easy"")","c(""1/2"", ""3/4"", ""1"", ""1/2"")","c(""instant coffee"", ""sugar"", ""nonfat dry milk solid"")",5.0,1.0,62.2,0.1,0.0,1.3,36.6,12.8,0.0,11.8,2.7,18.0,2 1/4 cups,"c(""Stir ingredients together."", ""Process in a blender until powdered."", ""Use 2 Tbsp.  of mixture for each cup of hot water."")","['https://img.sndimg.com/food/image/upload/w_555,h_416,c_fit,fl_progressive,q_95/v1/img/recipes/52/picAkC0UW.jpg', 'https://img.sndimg.com/food/image/upload/w_555,h_416,c_fit,fl_progressive,q_95/v1/img/recipes/52/piccYWEE1.jpg']","['instant coffee', 'sugar', 'nonfat dry milk solid']"
54.0,*54*,Carrot Cake,1535.0,Marg CaymanDesigns,PT50M,PT45M,PT1H35M,1999-09-13T15:20:00Z,This is one of the few recipes my husband every requested from a coworker and brought home for me to make.,"c(""https://img.sndimg.com/food/image/upload/w_555,h_416,c_fit,fl_progressive,q_95/v1/img/recipes/54/picQ2X4D8.jpg"", ""https://img.sndimg.com/food/image/upload/w_555,h_416,c_fit,fl_progressive,q_95/v1/img/recipes/54/pic3oloIV.jpg"", ""https://img.sndimg.com/food/image/upload/w_555,h_416,c_fit,fl_progressive,q_95/v1/img/recipes/54/picf0dw0o.jpg"")",Dessert,"c(""Vegetable"", ""Weeknight"", ""Oven"", ""< 4 Hours"")","c(""3"", ""4"", ""1 1/4"", ""2"", ""2"", ""2"", ""2"", ""1"", ""1"", ""1/2"", ""1"", ""1 1/4"", ""1"", ""1"", ""1/2"")","c(""carrots"", ""eggs"", ""white sugar"", ""all-purpose flour"", ""baking powder"", ""baking soda"", ""cinnamon"", ""salt"", ""nutmeg"", ""golden raisin"", ""confectioners' sugar"", ""cream cheese"", ""light corn syrup"", ""vanilla extract"")",5.0,17.0,522.6,27.1,4.9,69.8,534.8,67.0,1.6,47.9,5.0,12.0,1 bundt,"c(""Beat together the eggs, oil, and white sugar. Blend mixture for thirty seconds."", ""Sift together flour, baking powder, baking soda, salt and spices. Add the  carrots and raisins."", ""Pour egg mixture into dry ingredients, and mix well. Pour  batter into well greased 10 inch tube or Bundt pan."", ""Bake at 350 degrees F (175  degrees C) oven for 45 to 50 minutes. Cool cake on wire rack, and then  refrigerate until completely cooled."", ""To make Cream Cheese Glaze: Blend together  confectioners' sugar, cream cheese, corn syrup, and vanilla. Spread over cooled  cake.""
)","['https://img.sndimg.com/food/image/upload/w_555,h_416,c_fit,fl_progressive,q_95/v1/img/recipes/54/picQ2X4D8.jpg', 'https://img.sndimg.com/food/image/upload/w_555,h_416,c_fit,fl_progressive,q_95/v1/img/recipes/54/pic3oloIV.jpg', 'https://img.sndimg.com/food/image/upload/w_555,h_416,c_fit,fl_progressive,q_95/v1/img/recipes/54/picf0dw0o.jpg']","['carrots', 'eggs', 'white sugar', 'all-purpose flour', 'baking powder', 'baking soda', 'cinnamon', 'salt', 'nutmeg', 'golden raisin', ""confectioners' sugar"", 'cream cheese', 'light corn syrup', 'vanilla extract']"
66.0,*66*,Black Coffee Barbecue Sauce,174711.0,Queen Dragon Mom,PT20M,PT10M,PT30M,1999-09-10T21:43:00Z,"It's great to know folks like this sauce so much! I wish I could take credit for it but it was adopted after the original member left. Thank you, all, just the same.
I have made the recipe with regular brewed coffee but highly recommend the espresso. In a pinch use strong instant if you have nothing else. The acid of the coffee balances the sweetness of the other ingredients.","c(""https://img.sndimg.com/food/image/upload/w_555,h_416,c_fit,fl_progressive,q_95/v1/img/recipes/66/pic6Ysx4x.jpg"", ""https://img.sndimg.com/food/image/upload/w_555,h_416,c_fit,fl_progressive,q_95/v1/img/recipes/66/picknLY3c.jpg"", ""https://img.sndimg.com/food/image/upload/w_555,h_416,c_fit,fl_progressive,q_95/v1/img/recipes/66/piclB5wbq.jpg"")",Lactose Free,"c(""Low Protein"", ""Low Cholesterol"", ""Healthy"", ""Free Of..."", ""< 30 Mins"", ""Easy"")","c(""1/2"", ""1"", ""1/4"", ""3/4"", ""1"", ""2"", ""2"", ""2"", ""2"", ""2"", ""2"")","c(""brewed coffee"", ""ketchup"", ""red wine vinegar"", ""dark brown sugar"", ""onion"", ""garlic cloves"", ""dark molasses"", ""hot dry mustard"", ""Worcestershire sauce"", ""cumin"", ""chili powder"")",5.0,19.0,772.0,3.9,0.5,0.0,2241.9,189.6,6.4,164.3,7.0,,1 1/2 cups,"c(""Combine all ingredients in a saucepan and simmer over low heat for 20  minutes."", ""Cool, then puree in a blender or food processor until smooth."", ""This can be stored in the refrigerator for up to 2 weeks in a covered  container."")","['https://img.sndimg.com/food/image/upload/w_555,h_416,c_fit,fl_progressive,q_95/v1/img/recipes/66/pic6Ysx4x.jpg', 'https://img.sndimg.com/food/image/upload/w_555,h_416,c_fit,fl_progressive,q_95/v1/img/recipes/66/picknLY3c.jpg', 'https://img.sndimg.com/food/image/upload/w_555,h_416,c_fit,fl_progressive,q_95/v1/img/recipes/66/piclB5wbq.jpg']","['brewed coffee', 'ketchup', 'red wine vinegar', 'dark brown sugar', 'onion', 'garlic cloves', 'dark molasses', 'hot dry mustard', 'Worcestershire sauce', 'cumin', 'chili powder']"
85.0,*85*,Butter Madeira Cake,1543.0,Doreen Randal,PT1H45M,PT1H10M,PT2H55M,1999-09-12T06:01:00Z,Make and share this Butter Madeira Cake recipe from Food.com.,"c(""https://img.sndimg.com/food/image/upload/w_555,h_416,c_fit,fl_progressive,q_95/v1/img/recipes/85/picH7CI8k.jpg"", ""https://img.sndimg.com/food/image/upload/w_555,h_416,c_fit,fl_progressive,q_95/v1/img/recipes/85/picxHaQSq.jpg"", ""https://img.sndimg.com/food/image/upload/w_555,h_416,c_fit,fl_progressive,q_95/v1/img/recipes/85/pic3a9BE3.jpg"")",Dessert,"c(""Weeknight"", ""Oven"", ""< 4 Hours"")","c(""225"", ""2"", ""175"", ""175"", ""3"", ""1"", ""1"")","c(""flour"", ""baking powder"", ""caster sugar"", ""butter"", ""eggs"", ""milk"", ""vanilla essence"")",5.0,2.0,373.8,19.9,11.8,126.3,243.8,43.9,0.8,22.2,5.5,8.0,,"c(""Grease lined tin with melted butter."", ""Sift flour and baking powder into  processor and add all remaining ingredients."", ""Run machine for 20 counts."", ""Scrape  down sides."", ""Run machine for a further 30 counts."", ""Transfer to prepared tin and spread evenly with a spatula.  Bake at 160° C for 1 1/2 hours."", ""Leave in tin 15 minutes  before turning onto a rack."", ""VARIATIONS Seed cake = Add 2-3 tsp caraway seeds after scraping down the sides."", ""Orange Cake = omit vanilla."", ""Add 1 tsp orange peel."", 
""Lemon Cake = Add 1 tsp lemon peel."", ""Chocolate Speckle Cake = Add 1 crushed Chocolate Flake Bar after scraping down sides."", ""Raisin Cake = Add 3 oz raisins after scraping down sides."", ""Spicy Cake = Add 2-3 tsp Mixed Spice with the other ingredients."")","['https://img.sndimg.com/food/image/upload/w_555,h_416,c_fit,fl_progressive,q_95/v1/img/recipes/85/picH7CI8k.jpg', 'https://img.sndimg.com/food/image/upload/w_555,h_416,c_fit,fl_progressive,q_95/v1/img/recipes/85/picxHaQSq.jpg', 'https://img.sndimg.com/food/image/upload/w_555,h_416,c_fit,fl_progressive,q_95/v1/img/recipes/85/pic3a9BE3.jpg']","['flour', 'baking powder', 'caster sugar', 'butter', 'eggs', 'milk', 'vanilla essence']"
102.0,*102*,Cheesy Scalloped Potato Side Dish,125579.0,GrandmaIsCooking,PT1H30M,PT25M,PT1H55M,1999-08-14T20:12:00Z,"--Adopted Recipe--
This is a simple scalloped potato recipe.  Everyone has their own way of preparing them, and I guess some people will like it and some won't, but this method is very similar to the way I make them.  The original directions gave the crockpot cooking method as the preferred method, with oven baking as an option.  I have reversed this option, since I don't do much cooking in the crockpot.  I hate to leave any electric appliance on when no one is at home.","c(""https://img.sndimg.com/food/image/upload/w_555,h_416,c_fit,fl_progressive,q_95/v1/img/recipes/10/2/picKlg7Uh.jpg"", ""https://img.sndimg.com/food/image/upload/w_555,h_416,c_fit,fl_progressive,q_95/v1/img/recipes/10/2/picmDH8PY.jpg"", ""https://img.sndimg.com/food/image/upload/w_555,h_416,c_fit,fl_progressive,q_95/v1/img/recipes/10/2/picH4phGr.jpg"", ""https://img.sndimg.com/food/image/upload/w_555,h_416,c_fit,fl_progressive,q_95/v1/img/recipes/10/2/picEtXOFk.jpg"")",Potato,"c(""Cheese"", ""Vegetable"", ""Healthy"", ""Weeknight"", ""Oven"", ""< 4 Hours"")","c(""5"", ""1/4"", ""1 1/2"", ""1 1/2"", ""1/2"", NA, NA)","c(""potatoes"", ""flour"", ""half-and-half"", ""cheddar cheese"", ""parmesan cheese"", ""paprika"")",4.0,25.0,332.0,10.5,6.5,32.3,260.7,46.0,5.2,4.3,14.2,,,"c(""Layer potatoes, flour, milk, and salt and pepper (if desired) in a large casserole dish in several layers, then top with cheeses and paprika."", ""Bake at 350°F for 1 1/2 hours."", ""Optional crockpot method:  Spray crock pot with non-stick spray.  Layer ingredients in crockpot as directed for oven method.  Cook on high about 5 hours, until potatoes are tender."", ""All cooking times are approximate.  Preparation time allows for peeling and slicing potatoes.  Cooking time is for oven method."")","['https://img.sndimg.com/food/image/upload/w_555,h_416,c_fit,fl_progressive,q_95/v1/img/recipes/10/2/picKlg7Uh.jpg', 'https://img.sndimg.com/food/image/upload/w_555,h_416,c_fit,fl_progressive,q_95/v1/img/recipes/10/2/picmDH8PY.jpg', 'https://img.sndimg.com/food/image/upload/w_555,h_416,c_fit,fl_progressive,q_95/v1/img/recipes/10/2/picH4phGr.jpg', 'https://img.sndimg.com/food/image/upload/w_555,h_416,c_fit,fl_progressive,q_95/v1/img/recipes/10/2/picEtXOFk.jpg']","['potatoes', 'flour', 'half-and-half', 'cheddar cheese', 'parmesan cheese', 'paprika']"
109.0,*109*,Butterflied Lamb with Garlic Butter,1543.0,Doreen Randal,PT4H15M,PT45M,PT5H,1999-09-13T03:18:00Z,Make and share this Butterflied Lamb with Garlic Butter recipe from Food.com.,"c(""https://img.sndimg.com/food/image/upload/w_555,h_416,c_fit,fl_progressive,q_95/v1/img/recipes/10/9/picnSlN8g.jpg"", ""https://img.sndimg.com/food/image/upload/w_555,h_416,c_fit,fl_progressive,q_95/v1/img/recipes/10/9/picHIRziT.jpg"")",Lamb/Sheep,"c(""Meat"", ""High Protein"", ""High In..."", ""Weeknight"", ""Oven"")","c(""2"", ""1/4"", ""1"", ""1"", ""4"", ""1"", ""90"", ""1/4"", ""1"", ""250"", ""2"")","c(""lamb"", ""parsley"", ""fresh thyme"", ""lemon, rind of"", ""garlic"", ""cracked black pepper"", ""butter"", ""lemon juice"", ""small potato"", ""shallots"", ""olive oil"")",5.0,2.0,1194.6,74.8,33.0,312.1,348.1,52.7,8.0,7.7,75.9,4.0,,"c(""Open lamb out flat, place the fat-side down on a board.  Using a meat mallet or  rolling pin pound the lamb to even thickness."", ""Combine herbs, rind, garlic,  pepper and butter in a small bowl; spread the mixture over the fat-side of the  lamb."", ""Place lamb in a large shallow dish, drizzle the juice over.  Cover,  refrigerate 3 hours or overnight."", ""Place the potatoes and onions in a large  roasting dish; drizzle with oil.  Bake uncovered, in a moderately hot oven 20  minutes."", ""Place lamb, fat-side up, over the vegetables in the roasting dish.  Bake uncovered in moderately hot oven about 40 minutes or until lamb doneness as  desired."", 
""Remove the lamb from the dish, cover loosely with foil to keep warm."", ""Drain the excess juices from the pan, bake potatoes and onions in a very hot  oven another 15 minutes or until crisp."", ""Slice lamb and serve with the  vegetables."")","['https://img.sndimg.com/food/image/upload/w_555,h_416,c_fit,fl_progressive,q_95/v1/img/recipes/10/9/picnSlN8g.jpg', 'https://img.sndimg.com/food/image/upload/w_555,h_416,c_fit,fl_progressive,q_95/v1/img/recipes/10/9/picHIRziT.jpg']","['lamb', 'parsley', 'fresh thyme', 'lemon, rind of', 'garlic', 'cracked black pepper', 'butter', 'lemon juice', 'small potato', 'shallots', 'olive oil']"
114.0,*114*,Chicken Breasts Saltimbocca,39194.0,OzMan,PT6H,PT1H,PT7H,1999-08-14T20:09:00Z,Make and share this Chicken Breasts Saltimbocca recipe from Food.com.,"c(""https://img.sndimg.com/food/image/upload/w_555,h_416,c_fit,fl_progressive,q_95/v1/img/recipes/11/4/picn5ling.jpg"", ""https://img.sndimg.com/food/image/upload/w_555,h_416,c_fit,fl_progressive,q_95/v1/img/recipes/11/4/pickW002f.jpg"", ""https://img.sndimg.com/food/image/upload/w_555,h_416,c_fit,fl_progressive,q_95/v1/img/recipes/11/4/pic6wVin0.jpg"")",Chicken Breast,"c(""Chicken"", ""Poultry"", ""Meat"", ""European"", ""Weeknight"")","c(""6"", ""6"", ""6"", ""1/4"", ""1/4"", ""1"", ""1/2"", ""1/4"", ""1/3"", ""1"", ""1/2"", ""1/4"", ""1/4"", NA)","c(""boneless skinless chicken breast halves"", ""ham slices"", ""swiss cheese"", ""all-purpose flour"", ""parmesan cheese"", ""salt"", ""dried sage"", ""pepper"", ""dry white wine"", ""cornstarch"", ""water"", ""rice"")",5.0,5.0,511.9,29.5,9.6,124.9,1357.2,15.8,0.6,0.9,40.6,6.0,,"c(""Pound chicken breast halves until thin between  two sheets of waxed paper or  foil."", ""Place a slice of ham and cheese on each chicken piece.  Roll up and tuck  ends in; secure with small skewers or  wooden picks."", ""Combine flour, Parmesan  cheese, salt, sage and pepper in a shallow bowl."", ""Coat chicken rolls in flour  mixture.  Refrigerate chicken at least 1 hour."", ""In a large skillet, heat oil  over medium heat.  Add chicken rolls and cook, turning, until browned on all  sides."", ""Place browned chicken in a slow cooker."", 
""Combine soup and wine and pour  over chicken rolls."", ""Cover and cook on LOW 4 to 5 hours or until chicken is  tender."", ""Turn control to HIGH."", ""In a small bowl, dissolve cornstarch in water;  stir into cooking juices in cooker."", ""Cover and cook on HIGH 10 minutes."", ""Serve  with hot rice."")","['https://img.sndimg.com/food/image/upload/w_555,h_416,c_fit,fl_progressive,q_95/v1/img/recipes/11/4/picn5ling.jpg', 'https://img.sndimg.com/food/image/upload/w_555,h_416,c_fit,fl_progressive,q_95/v1/img/recipes/11/4/pickW002f.jpg', 'https://img.sndimg.com/food/image/upload/w_555,h_416,c_fit,fl_progressive,q_95/v1/img/recipes/11/4/pic6wVin0.jpg']","['boneless skinless chicken breast halves', 'ham slices', 'swiss cheese', 'all-purpose flour', 'parmesan cheese', 'salt', 'dried sage', 'pepper', 'dry white wine', 'cornstarch', 'water', 'rice']"
128.0,*128*,Caramel Apple Milkshakes,1530.0,Carole Reu,,PT25M,PT25M,1999-09-12T05:43:00Z,Make and share this Caramel Apple Milkshakes recipe from Food.com.,"c(""https://img.sndimg.com/food/image/upload/w_555,h_416,c_fit,fl_progressive,q_95/v1/img/recipes/12/8/picfvdzrj.jpg"", ""https://img.sndimg.com/food/image/upload/w_555,h_416,c_fit,fl_progressive,q_95/v1/img/recipes/12/8/picQZEhmD.jpg"")",Frozen Desserts,"c(""Beverages"", ""Dessert"", ""Apple"", ""Fruit"", ""Low Protein"", ""Low Cholesterol"", ""Healthy"", ""< 30 Mins"", ""Easy"")","c(""3"", ""3/4"", ""1/2"", ""1"", ""1/4"")","c(""frozen yogurt"", ""1% low-fat milk"", ""applesauce"", ""cinnamon"")",5.0,2.0,208.7,6.5,4.2,26.4,185.3,31.2,0.9,10.9,8.3,4.0,,"c(""Place the yogurt, milk, cinnamon, and topping in a blender."", ""Cover and blend  until smooth."", ""Pour into 4 glasses."", ""Serve immediately."")","['https://img.sndimg.com/food/image/upload/w_555,h_416,c_fit,fl_progressive,q_95/v1/img/recipes/12/8/picfvdzrj.jpg', 'https://img.sndimg.com/food/image/upload/w_555,h_416,c_fit,fl_progressive,q_95/v1/img/recipes/12/8/picQZEhmD.jpg']","['frozen yogurt', '1% low-fat milk', 'applesauce', 'cinnamon']"
