RecipeId,Barcode,Name,AuthorId,AuthorName,CookTime,PrepTime,TotalTime,DatePublished,Description,Images,RecipeCategory,Keywords,RecipeIngredientQuantities,RecipeIngredientParts,AggregatedRating,ReviewCount,Calories,FatContent,SaturatedFatContent,CholesterolContent,SodiumContent,CarbohydrateContent,FiberContent,SugarContent,ProteinContent,RecipeServings,RecipeYield,RecipeInstructions,extracted_image_urls,extracted_ingredients
556.0,*556*,Garlic Pizza Crust,451242.0,Robbyn Snider,,PT1H30M,PT1H30M,1999-08-25T06:55:00Z,"This is the best ..one of the few recipes that is mine  This started off as a  mistake, turning back and forth in a cook book We make this  every Friday night  and have pizza and movies in the living room..   Garlic Pizza Crust","c(""https://img.sndimg.com/food/image/upload/w_555,h_416,c_fit,fl_progressive,q_95/v1/img/recipes/55/6/picvxagfH.jpg"", ""https://img.sndimg.com/food/image/upload/w_555,h_416,c_fit,fl_progressive,q_95/v1/img/recipes/55/6/pic2TKBZv.jpg"")",Breads,"c(""Low Cholesterol"", ""Healthy"", ""Weeknight"", ""Oven"", ""< 4 Hours"")","c(""2"", ""2"", ""2"", ""1/2"", ""1"", ""5 1/2 - 6"", ""3"")","c(""water"", ""sugar"", ""salt"", ""flour"", ""garlic cloves"")",4.5,12.0,1814.5,58.5,7.7,0.0,1181.7,279.7,11.5,13.6,39.0,,2 cookie sheet size crusts,"c(""Dissolve yeast in water and add sugar."", ""wait a few minutes."", ""add oil  and salt  and garlic ."", ""mix in 3 cups flour and whip about 10 min till it leaves the  side of the mixer bowl."", ""add remaining flour w/ dough hook or by hand."", ""knead  till  smooth."", ""allow to rise twice in the bowl."", ""punch down."", ""(I rush this a bit) oil  baking sheets .use fingers press out to edges."", ""Makes 2 pizzas, cookie sheet size, let rise a bit and top."", ""bake at  425*  20min.this is fantastic."", ""crust smells slightly like garlic  bread."", 
""but is  notstrong."", ""We usually make one cheese and the  other with ground."", ""beef, ham,  onion and mushroom."", ""Even the kids say it is the best crust so far."", ""This makes  2 cookie sheet sized or 12 after school snack size I  form them in thebottom of  a cheapo pie pan, top and bake  completely and put them in zip bags."")","['https://img.sndimg.com/food/image/upload/w_555,h_416,c_fit,fl_progressive,q_95/v1/img/recipes/55/6/picvxagfH.jpg', 'https://img.sndimg.com/food/image/upload/w_555,h_416,c_fit,fl_progressive,q_95/v1/img/recipes/55/6/pic2TKBZv.jpg']","['water', 'sugar', 'salt', 'flour', 'garlic cloves']"
565.0,*565*,Greek Low-Fat Red Pepper Feta Dip,1533.0,Dancer,PT50M,PT5M,PT55M,1999-08-06T00:40:00Z,"No mezi, or hors-d'oeuvre, platter is complete without a dip, and this simple one is intensely flavourful. Serve with pitas, flatbreads or crisp vegetables.","c(""https://img.sndimg.com/food/image/upload/w_555,h_416,c_fit,fl_progressive,q_95/v1/img/recipes/56/5/picMa7teL.jpg"", ""https://img.sndimg.com/food/image/upload/w_555,h_416,c_fit,fl_progressive,q_95/v1/img/recipes/56/5/picSQETut.jpg"")",Cheese,"c(""Peppers"", ""Vegetable"", ""Greek"", ""European"", ""Free Of..."", ""< 60 Mins"", ""Easy"")","c(""2"", ""1"", ""2"", ""1"", ""1"")","c(""feta cheese"", ""red wine vinegar"", ""granulated sugar"", ""cayenne"")",4.5,5.0,501.8,33.0,22.5,133.5,1688.1,26.4,7.0,20.2,24.6,,1 cup,"c(""Place peppers on greased grill over medium-high heat; close lid and cook, turning often, for 15 to 20 minutes or until charred."", ""Let cool; peel and seed."", ""In blender or food processor, puree together peppers, feta cheese, vinegar, sugar and cayenne."", ""(Dip can be refrigerated in airtight container for up to 5 days; let stand at room temperature for 30 minutes.)."")","['https://img.sndimg.com/food/image/upload/w_555,h_416,c_fit,fl_progressive,q_95/v1/img/recipes/56/5/picMa7teL.jpg', 'https://img.sndimg.com/food/image/upload/w_555,h_416,c_fit,fl_progressive,q_95/v1/img/recipes/56/5/picSQETut.jpg']","['feta cheese', 'red wine vinegar', 'granulated sugar', 'cayenne']"
571.0,*571*,Fried Cornbread,1639.0,elt8588,,PT40M,PT40M,1999-08-08T17:24:00Z,"This recipe has been in my family for several generations.  In Louisiana, we serve this with boiled cabbage, turnip greens, black-eyed peas, and butterbeans.  It is delicious, but takes practice to make it just right.","c(""https://img.sndimg.com/food/image/upload/w_555,h_416,c_fit,fl_progressive,q_95/v1/img/recipes/57/1/picV7RbgS.jpg"", ""https://img.sndimg.com/food/image/upload/w_555,h_416,c_fit,fl_progressive,q_95/v1/img/recipes/57/1/picvcfo4j.jpg"", ""https://img.sndimg.com/food/image/upload/w_555,h_416,c_fit,fl_progressive,q_95/v1/img/recipes/57/1/picDQdyKP.jpg"")",Quick Breads,"c(""Breads"", ""Lactose Free"", ""Low Protein"", ""Vegan"", ""Low Cholesterol"", ""Egg Free"", ""Healthy"", ""Kosher"", ""Free Of..."", ""< 60 Mins"", ""Easy"")","c(""1 1/2"", ""1/2"", ""2"")","c(""salt"", ""boiling water"")",4.5,15.0,611.2,6.2,0.9,0.0,3459.0,128.6,12.3,0.0,15.2,,1 batch,"c(""Mix cornmeal and salt together in large mixing bowl."", ""Pour approximately 2 cups boiling water over dry ingredients."", ""Mix well."", ""After the mixture cools slightly, shape mixture into balls about the size of golfballs, one at a time.  You must wet your hands with water before you make each ball."", ""Flatten the ball with your fingers."", ""Fry in skillet (preferably cast iron) with about 1/2 inch of hot oil."", ""Fry until golden brown on both sides."", ""Delicious!"")","['https://img.sndimg.com/food/image/upload/w_555,h_416,c_fit,fl_progressive,q_95/v1/img/recipes/57/1/picV7RbgS.jpg', 'https://img.sndimg.com/food/image/upload/w_555,h_416,c_fit,fl_progressive,q_95/v1/img/recipes/57/1/picvcfo4j.jpg', 'https://img.sndimg.com/food/image/upload/w_555,h_416,c_fit,fl_progressive,q_95/v1/img/recipes/57/1/picDQdyKP.jpg']","['salt', 'boiling water']"
572.0,*572*,Fried Green Tomatoes,1640.0,Seausoon39,PT15M,PT40M,PT55M,1999-08-23T20:45:00Z,Make and share this Fried Green Tomatoes recipe from Food.com.,"c(""https://img.sndimg.com/food/image/upload/w_555,h_416,c_fit,fl_progressive,q_95/v1/img/recipes/57/2/picBXHqfo.jpg"", ""https://img.sndimg.com/food/image/upload/w_555,h_416,c_fit,fl_progressive,q_95/v1/img/recipes/57/2/picpYVU6P.jpg"", ""https://img.sndimg.com/food/image/upload/w_555,h_416,c_fit,fl_progressive,q_95/v1/img/recipes/57/2/picJpXoVp.jpg"", ""https://img.sndimg.com/food/image/upload/w_555,h_416,c_fit,fl_progressive,q_95/v1/img/recipes/57/2/picWyb5Qq.jpg"")",Vegetable,"c(""Low Protein"", ""< 60 Mins"")","c(""6"", ""1"", ""1/2"", ""1/2"", ""1/4"", ""1/4"")","c(""green tomatoes"", ""sugar"", ""flour"", ""salt"", ""pepper"", ""butter"")",5.0,9.0,134.3,8.0,4.9,20.3,277.5,14.3,1.7,5.0,2.6,6.0,,"c(""Sprinkle sliced tomatoes with sugar, let stand about 15 minutes."", ""Combine flour, salt and pepper and coat tomato slices."", ""Melt 2 tbsp  butter in skillet."", ""Brown  tomatoes  slowly on both sides."", ""Remove each batch to oven proof platter and  keep in oven until all tomatoes are cooked."", ""Add more butter if needed."", ""For  crisp slices, serve as is."", ""Or add 1/2 cup light cream or dairy half and half to skillet. Heat, stirring into drippings, and pour over tomatoes."")","['https://img.sndimg.com/food/image/upload/w_555,h_416,c_fit,fl_progressive,q_95/v1/img/recipes/57/2/picBXHqfo.jpg', 'https://img.sndimg.com/food/image/upload/w_555,h_416,c_fit,fl_progressive,q_95/v1/img/recipes/57/2/picpYVU6P.jpg', 'https://img.sndimg.com/food/image/upload/w_555,h_416,c_fit,fl_progressive,q_95/v1/img/recipes/57/2/picJpXoVp.jpg', 'https://img.sndimg.com/food/image/upload/w_555,h_416,c_fit,fl_progressive,q_95/v1/img/recipes/57/2/picWyb5Qq.jpg']","['green tomatoes', 'sugar', 'flour', 'salt', 'pepper', 'butter']"
593.0,*593*,Fried Green Tomatoes II,2178.0,troyh,PT5M,PT15M,PT20M,1999-09-10T04:50:00Z,Make and share this Fried Green Tomatoes II recipe from Food.com.,"c(""https://img.sndimg.com/food/image/upload/w_555,h_416,c_fit,fl_progressive,q_95/v1/img/recipes/59/3/picQUreIW.jpg"", ""https://img.sndimg.com/food/image/upload/w_555,h_416,c_fit,fl_progressive,q_95/v1/img/recipes/59/3/pic8h7L5Z.jpg"")",Vegetable,"c(""Very Low Carbs"", ""Low Protein"", ""Low Cholesterol"", ""Healthy"", ""< 30 Mins"", ""Easy"")","c(""1"", NA, NA, NA, NA)","c(""green tomato"", ""salt"", ""pepper"", ""white cornmeal"", ""bacon drippings"")",5.0,10.0,28.3,0.2,0.0,0.0,16.0,6.3,1.4,4.9,1.5,1.0,,"c(""Slice tomatoes about 1/4 inch thick, season with salt and pepper and then coat both sides with cornmeal."", ""In a large skillet, heat enough bacon drippings to coat the bottom of the pan, and fry tomatoes until lightly browned on both sides."", ""This recipe was from the back of Fannie Flagg's novel, \""Fried Green Tomatoes at the Whistle Stop Cafe\""."")","['https://img.sndimg.com/food/image/upload/w_555,h_416,c_fit,fl_progressive,q_95/v1/img/recipes/59/3/picQUreIW.jpg', 'https://img.sndimg.com/food/image/upload/w_555,h_416,c_fit,fl_progressive,q_95/v1/img/recipes/59/3/pic8h7L5Z.jpg']","['green tomato', 'salt', 'pepper', 'white cornmeal', 'bacon drippings']"
605.0,*605*,English Pub Beef &amp; Kidney Stew in Yorkshire Pudding (Adopted,129357.0,Honni,PT2H,PT30M,PT2H30M,1999-08-21T11:28:00Z,This is the sort of meal you would like to come home to on a cold winters night. It is a very rich and filling meal.,"c(""https://img.sndimg.com/food/image/upload/w_555,h_416,c_fit,fl_progressive,q_95/v1/img/recipes/60/5/piceGiPm2.jpg"", ""https://img.sndimg.com/food/image/upload/w_555,h_416,c_fit,fl_progressive,q_95/v1/img/recipes/60/5/picZvJAZv.jpg"", ""https://img.sndimg.com/food/image/upload/w_555,h_416,c_fit,fl_progressive,q_95/v1/img/recipes/60/5/picX5tS3M.jpg"")",Stew,"c(""Meat"", ""European"", ""Weeknight"", ""Oven"", ""< 4 Hours"")","c(""1"", ""2"", ""1/4"", ""4"", ""1"", ""125"", ""1"", ""1"", ""1"", ""1"", ""1/2"", ""1/4"", ""1/4"", ""1/4"", ""2"", ""2"", ""1"", ""1"", ""1/2"", ""2"")","c(""flour"", ""onion"", ""mushrooms"", ""beef broth"", ""dry red wine"", ""tomato paste"", ""Worcestershire sauce"", ""salt"", ""pepper"", ""tarragon"", ""rosemary"", ""carrots"", ""eggs"", ""milk"", ""flour"", ""salt"")",5.0,9.0,930.0,40.3,10.5,299.0,1094.5,41.8,2.8,4.2,84.9,4.0,,"c(""Make Yorkshire Pudding first and let rest in fridge while stew is cooking."", ""Beat 2 eggs in bowl."", ""Mix in 1 cup of milk, sift in 1 cup of flour and 1/2 tsp salt. Beat until smooth."", ""For the Stew."", ""Coat  steak and kidneys with flour."", ""Brown several pieces at a time in oil in   stock pot; remove. Sauté onion in pan drippings until tender."", ""Add mushrooms."", ""Cok for several minutes longer."", ""Stir in broth, wine, tomato paste and next 5  seasonings and diced carrots. Return meat to the pan."", 
""Cover and cook on a slow simmer,for 2 hours or until tender (don't let stew dry out, add a little water if needed and reduce heat slightly)."", ""Preheat oven to 200°C."", ""Heat 2 tbs oil in a 6-8 cup casserole. Pour batter into hot casserole dish. Spoon stew over batter to within 1 inch of edge. Bake at 200c  for 30 minutes or until puffed and brown."", ""Serve with mashed potatoes and greens."")","['https://img.sndimg.com/food/image/upload/w_555,h_416,c_fit,fl_progressive,q_95/v1/img/recipes/60/5/piceGiPm2.jpg', 'https://img.sndimg.com/food/image/upload/w_555,h_416,c_fit,fl_progressive,q_95/v1/img/recipes/60/5/picZvJAZv.jpg', 'https://img.sndimg.com/food/image/upload/w_555,h_416,c_fit,fl_progressive,q_95/v1/img/recipes/60/5/picX5tS3M.jpg']","['flour', 'onion', 'mushrooms', 'beef broth', 'dry red wine', 'tomato paste', 'Worcestershire sauce', 'salt', 'pepper', 'tarragon', 'rosemary', 'carrots', 'eggs', 'milk', 'flour', 'salt']"
612.0,*612*,Freezer Apricot Jam,1533.0,Dancer,PT24H25M,PT20M,PT24H45M,1999-08-10T18:47:00Z,Make and share this Freezer Apricot Jam recipe from Food.com.,"c(""https://img.sndimg.com/food/image/upload/w_555,h_416,c_fit,fl_progressive,q_95/v1/img/recipes/61/2/pic1LDsb7.jpg"", ""https://img.sndimg.com/food/image/upload/w_555,h_416,c_fit,fl_progressive,q_95/v1/img/recipes/61/2/picGozDXk.jpg"", ""https://img.sndimg.com/food/image/upload/w_555,h_416,c_fit,fl_progressive,q_95/v1/img/recipes/61/2/picGDWK7o.jpg"")",Fruit,"c(""Free Of..."", ""Weeknight"", ""Canning"", ""Freezer"", ""Easy"")","c(""3"", ""1"", ""1/8"", ""5"", ""1/2"")","c(""apricots"", ""lemon juice"", ""lemon, rind of"", ""granulated sugar"")",5.0,1.0,4111.1,2.0,0.1,0.0,15.1,1055.9,10.0,1044.1,7.0,,1 batch,"c(""Mix apricots, lemon juice and rind."", ""Add sugar, stir 5 minutes until sugar dissolves."", ""Let stand 20 minutes."", ""Stir in pectin."", ""Ladle into cartons or jars, filling to within 1/2 inch of top."", ""Cover with cloth and let stand until set, 24 hours or overnight. Cover and freeze. To serve, thaw and store in refrigerator."", ""(Freeze for 1 month before thawing to use)."")","['https://img.sndimg.com/food/image/upload/w_555,h_416,c_fit,fl_progressive,q_95/v1/img/recipes/61/2/pic1LDsb7.jpg', 'https://img.sndimg.com/food/image/upload/w_555,h_416,c_fit,fl_progressive,q_95/v1/img/recipes/61/2/picGozDXk.jpg', 'https://img.sndimg.com/food/image/upload/w_555,h_416,c_fit,fl_progressive,q_95/v1/img/recipes/61/2/picGDWK7o.jpg']","['apricots', 'lemon juice', 'lemon, rind of', 'granulated sugar']"
615.0,*615*,Easy Garlic Chicken Breasts,2178.0,troyh,PT3H30M,PT35M,PT4H5M,1999-08-15T07:48:00Z,"This is really simple, but surprisingly good.   The chicken is somewhat garlicky and tangy because of the lime juice, but it is not too strong-tasting. It goes great with mashed potatoes and corn muffins.","c(""https://img.sndimg.com/food/image/upload/w_555,h_416,c_fit,fl_progressive,q_95/v1/img/recipes/61/5/picaSHBRu.jpg"", ""https://img.sndimg.com/food/image/upload/w_555,h_416,c_fit,fl_progressive,q_95/v1/img/recipes/61/5/picWBCvqF.jpg"", ""https://img.sndimg.com/food/image/upload/w_555,h_416,c_fit,fl_progressive,q_95/v1/img/recipes/61/5/picsVgI8G.jpg"")",Chicken Breast,"c(""Chicken"", ""Poultry"", ""Meat"", ""Very Low Carbs"", ""Free Of..."", ""Weeknight"", ""Oven"", ""Easy"")","c(""1/4"", ""1/4"", ""1"", ""2"", NA)","c(""lime juice"", ""olive oil"", ""garlic"", ""boneless skinless chicken breasts"")",4.5,32.0,387.0,30.1,4.4,75.5,138.7,3.9,0.2,0.6,25.4,2.0,,"c(""In a medium bowl, whisk together the lime juice, olive oil, and garlic."", ""Season with salt  and pepper generously, and add chicken, making sure it is well-coated with the  marinade.  Marinate chicken, covered in fridge for at least 3 hours and  preferably overnight. Preheat oven to 400 degrees F."", ""Remove chicken from  marinade and discard marinade.  Arrange chicken breasts in a shallow baking pan."", ""Season with salt and pepper and roast for 25-30 minutes or until chicken is  cooked through and the juices run clear when you prick it with a fork.""
)","['https://img.sndimg.com/food/image/upload/w_555,h_416,c_fit,fl_progressive,q_95/v1/img/recipes/61/5/picaSHBRu.jpg', 'https://img.sndimg.com/food/image/upload/w_555,h_416,c_fit,fl_progressive,q_95/v1/img/recipes/61/5/picWBCvqF.jpg', 'https://img.sndimg.com/food/image/upload/w_555,h_416,c_fit,fl_progressive,q_95/v1/img/recipes/61/5/picsVgI8G.jpg']","['lime juice', 'olive oil', 'garlic', 'boneless skinless chicken breasts']"
623.0,*623*,End of Summer Ratatouille,10033.0,spatchcock,PT32M,PT45M,PT1H17M,1999-08-23T12:39:00Z,"This is one of the recipes I adopted.  With proper instructions to follow, it's very tasty!  Thank goodness we can get a variety of fresh produce year round!","c(""https://img.sndimg.com/food/image/upload/w_555,h_416,c_fit,fl_progressive,q_95/v1/img/recipes/62/3/picxuXrQP.jpg"", ""https://img.sndimg.com/food/image/upload/w_555,h_416,c_fit,fl_progressive,q_95/v1/img/recipes/62/3/picpihGnV.jpg"")",Free Of...,"c(""Summer"", ""Weeknight"", ""Oven"", ""< 4 Hours"")","c(""1/4"", ""1"", ""2"", ""2"", ""1"", ""1"", ""1"", ""3"", ""1/4"", ""1"", ""4"", ""1"", ""1"", ""2"", ""1/2"", ""11"")","c(""olive oil"", ""eggplant"", ""zucchini"", ""red bell pepper"", ""yellow bell pepper"", ""green bell pepper"", ""tomatoes"", ""Italian parsley"", ""red onion"", ""garlic"", ""kosher salt"", ""fresh ground black pepper"", ""olive oil"", ""fresh basil leaf"", ""parmesan cheese"")",4.0,3.0,157.1,10.7,1.5,0.0,890.0,15.2,5.4,6.7,3.4,8.0,,"c(""Mix together in a small bowl:  parsley, red onion, garlic, 1 Tbsp salt,  1 tsp black pepper,  2 Tbsp olive oil"", ""In Medium skillet, heat oil and saute eggplant and red onion until soft, stirring often."", ""Transfer eggplant/onion and oil into decorative 9x13 or larger, baking dish."", ""Toss remaining vegetables, except the tomatoes, with the parsley garlic mixture and fold into the eggplant mixture."", ""Scatter tomatoes on top."", ""Cover with foil."", ""Bake at 350 degrees for 30 to 45 minutes, or until vegetables are bubbly."", 
""While baking, prepare topping: Combine 1/2 cup chopped fresh basil leaves with your choice of cheese: 11 oz log montrachet or chevre cheese, crumbled or 1 cup grated Parmesan cheese"", ""Remove foil and top with basil and cheese mixture, return to oven for a scant 5 minutes."", ""Serve at once."")","['https://img.sndimg.com/food/image/upload/w_555,h_416,c_fit,fl_progressive,q_95/v1/img/recipes/62/3/picxuXrQP.jpg', 'https://img.sndimg.com/food/image/upload/w_555,h_416,c_fit,fl_progressive,q_95/v1/img/recipes/62/3/picpihGnV.jpg']","['olive oil', 'eggplant', 'zucchini', 'red bell pepper', 'yellow bell pepper', 'green bell pepper', 'tomatoes', 'Italian parsley', 'red onion', 'garlic', 'kosher salt', 'fresh ground black pepper', 'olive oil', 'fresh basil leaf', 'parmesan cheese']"
626.0,*626*,Ezekiel Bread,1530.0,Carole Reu,PT1H10M,PT45M,PT1H55M,1999-08-11T05:09:00Z,Make and share this Ezekiel Bread recipe from Food.com.,"c(""https://img.sndimg.com/food/image/upload/w_555,h_416,c_fit,fl_progressive,q_95/v1/img/recipes/62/6/picoQ9FQN.jpg"", ""https://img.sndimg.com/food/image/upload/w_555,h_416,c_fit,fl_progressive,q_95/v1/img/recipes/62/6/picKjh5cX.jpg"")",Yeast Breads,"c(""Breads"", ""Lentil"", ""Beans"", ""Lactose Free"", ""Low Cholesterol"", ""Egg Free"", ""Healthy"", ""Kosher"", ""Free Of..."", ""Weeknight"", ""For Large Groups"", ""Oven"", ""< 4 Hours"")","c(""8"", ""4"", ""2"", ""1"", ""1/2"", ""1/4"", ""1 1/2"", ""1"", ""5"", ""2"", ""1/2"", ""1"")","c(""wheat flour"", ""lentils"", ""water"", ""salt"", ""olive oil"", ""warm water"", ""honey"")",4.0,6.0,151.4,2.9,0.4,0.0,147.3,27.4,4.3,0.9,5.9,48.0,4 loaves,"c(""Dissolve the yeast in warm water and let set for 10 minutes."", ""Mix the other dry  ingredients in separate bowl."", ""Blend lentils, oil, honey and small amount of water;  place in large mixing bowl with remaining water."", ""Stir in 2 cups of mixed flour."", ""Add yeast mixture.  Stir in remaining salt and flour."", ""Knead on floured surface, then place in oiled bowl."", ""Let rise until double in bulk."", ""Knead again; shape  and place in greased loaf pans."", ""Let rise.  Bake 375 for 1 hour."", ""- - - - - - - - - - - - - - - - - -  NOTES : A Health Food Store is a source for some of these ingredients.""
)","['https://img.sndimg.com/food/image/upload/w_555,h_416,c_fit,fl_progressive,q_95/v1/img/recipes/62/6/picoQ9FQN.jpg', 'https://img.sndimg.com/food/image/upload/w_555,h_416,c_fit,fl_progressive,q_95/v1/img/recipes/62/6/picKjh5cX.jpg']","['wheat flour', 'lentils', 'water', 'salt', 'olive oil', 'warm water', 'honey']"
648.0,*648*,Cucumber Salad with Spicy Wasabi Dressing,1533.0,Dancer,PT5M,PT25M,PT30M,1999-08-14T06:12:00Z,Make and share this Cucumber Salad with Spicy Wasabi Dressing recipe from Food.com.,"c(""https://img.sndimg.com/food/image/upload/w_555,h_416,c_fit,fl_progressive,q_95/v1/img/recipes/64/8/picYwuBMd.jpg"", ""https://img.sndimg.com/food/image/upload/w_555,h_416,c_fit,fl_progressive,q_95/v1/img/recipes/64/8/pic6vuyKo.jpg"")",Free Of...,"c(""Spicy"", ""< 30 Mins"")","c(""1 1/2"", ""2"", ""2"", ""2"", ""1"", NA, ""1"", ""1"")","c(""dry wasabi"", ""cucumbers"", ""distilled white vinegar"", ""sugar"", ""green onions"", ""scallions"", ""black sesame seeds"", ""sesame seeds"")",5.0,19.0,55.8,2.4,0.4,0.0,4.0,8.6,1.2,4.7,1.5,4.0,,"c(""Mix the wasabi with 1/2 teaspoon warm water in the bottom of a mixing bowl and let it stand for 5 minutes."", ""Peel the cucumbers, cut each one in half lengthwise, and use a melon baller or spoon to scoop out the seeds."", ""Cut the cucumbers widthwise into 1/4-inch crescents."", ""Add the vinegar and sugar to the wasabi and whisk until smooth."", ""Whisk in the sesame oil, salt, and pepper."", ""Just before serving, add the cucumbers, green onion, and sesame seeds to the dressing and mix well."")","['https://img.sndimg.com/food/image/upload/w_555,h_416,c_fit,fl_progressive,q_95/v1/img/recipes/64/8/picYwuBMd.jpg', 'https://img.sndimg.com/food/image/upload/w_555,h_416,c_fit,fl_progressive,q_95/v1/img/recipes/64/8/pic6vuyKo.jpg']","['dry wasabi', 'cucumbers', 'distilled white vinegar', 'sugar', 'green onions', 'scallions', 'black sesame seeds', 'sesame seeds']"
651.0,*651*,Curried Chicken Muffins,1624.0,Alma796,PT30M,PT1H,PT1H30M,1999-08-10T18:55:00Z,I love savoury muffins.  Here's an unusual one I got off a lifestyle programme  called Burke's Backyard in Australia.  Curried Chicken Muffins - makes 12 - tastes good in lunch boxes,"c(""https://img.sndimg.com/food/image/upload/w_555,h_416,c_fit,fl_progressive,q_95/v1/img/recipes/65/1/picpqEMfO.jpg"", ""https://img.sndimg.com/food/image/upload/w_555,h_416,c_fit,fl_progressive,q_95/v1/img/recipes/65/1/picJOZSHX.jpg"")",Quick Breads,"c(""Breads"", ""Chicken Thigh & Leg"", ""Chicken"", ""Poultry"", ""Meat"", ""Australian"", ""Weeknight"", ""Oven"", ""< 4 Hours"")","c(""2"", ""3"", ""3"", ""2"", ""1"", ""2 1/4"", ""1/2"", ""2"", ""2"", ""2"")","c(""onions"", ""chicken thigh fillets"", ""curry paste"", ""self raising flour"", ""eggs"", ""lemon juice"", ""fresh coriander leaves"")",4.5,2.0,244.3,13.8,2.4,52.2,48.7,22.1,1.0,2.3,7.9,,12 muffins,"c(""Preheat oven to 190 C (380F).  Grease a 12 hole muffin tin with butter and oil."", ""Make sure to grease the top of the tin well so any mix won't stick as they rise. Heat oil in a pan and cook the onion rings over a medium heat, stirring often."", ""Cook but DON'T brown them, adding a splash of water helps (you want them to stay white looking for effect - so they say), takes 5-10 minutes."", ""Put the onions  aside.  3/4 will be used for presentation, chop the other 1/4."", ""Heat the pan  again and add a little bit of oil and the chicken."", 
""Stir until it begins to turn white and then add the curry paste.  Cook slightly, adding a splash of water to  speed up the process."", ""Cook for a further minute then remove from the heat and  stir in the yoghurt.  Let it cool slightly."", ""Sift flour into a large bowl from a good height to aerate it well."", ""Add the chopped onions, lemon juice, eggs,  vegetable oil, cooled curried chicken and chopped coriander and mix well."", ""Spoon the mixture into the greased muffin tin and push the onion rigs on top by gently pressing in."", 
""Bake in preheated oven for 15-20 minutes until risen and golden."", ""Allow to cool completely."", ""Good picnic food."", ""Enjoy!"")","['https://img.sndimg.com/food/image/upload/w_555,h_416,c_fit,fl_progressive,q_95/v1/img/recipes/65/1/picpqEMfO.jpg', 'https://img.sndimg.com/food/image/upload/w_555,h_416,c_fit,fl_progressive,q_95/v1/img/recipes/65/1/picJOZSHX.jpg']","['onions', 'chicken thigh fillets', 'curry paste', 'self raising flour', 'eggs', 'lemon juice', 'fresh coriander leaves']"
652.0,*652*,Curried Crab in Endive Spears,1554.0,Jacques Lorrain,PT8H,PT30M,PT8H30M,1999-09-05T20:08:00Z,Make and share this Curried Crab in Endive Spears recipe from Food.com.,"c(""https://img.sndimg.com/food/image/upload/w_555,h_416,c_fit,fl_progressive,q_95/v1/img/recipes/65/2/picj4JgL4.jpg"", ""https://img.sndimg.com/food/image/upload/w_555,h_416,c_fit,fl_progressive,q_95/v1/img/recipes/65/2/picxpbpmK.jpg"")",Crab,"c(""Weeknight"", ""Easy"")","c(""1/4"", ""2"", ""2"", ""1"", ""1"", ""4"", ""2"")","c(""mayonnaise"", ""celery"", ""onions"", ""curry powder"", ""Belgian endive"", ""fresh cilantro"")",5.0,3.0,24.8,1.0,0.2,0.6,36.8,3.6,2.7,0.4,1.1,,24 pieces,"c(""Combine first 4 ingredients in small bowl."", ""Mix in crab meat. Season"", ""to taste with pepper."", ""(Can be prepared 8 hours ahead."", ""Cover and refrigerate.) Place 1 heaping tsp crab mixture on base of each endive spear."", ""Sprinkle with cilantro."", ""Arrange on platter in spoke pattern and serve."")","['https://img.sndimg.com/food/image/upload/w_555,h_416,c_fit,fl_progressive,q_95/v1/img/recipes/65/2/picj4JgL4.jpg', 'https://img.sndimg.com/food/image/upload/w_555,h_416,c_fit,fl_progressive,q_95/v1/img/recipes/65/2/picxpbpmK.jpg']","['mayonnaise', 'celery', 'onions', 'curry powder', 'Belgian endive', 'fresh cilantro']"
